{
 "contract": "program_portfolio",
 "version": "0.2.0",
 "produced_by": "profiles",
 "input_sha256": "94f26944eb563d5830c84b1c257e46a698a647978d412f10925e6373a55340ed",
 "brief_id": null,
 "consumers": [
  "areas",
  "viz"
 ],
 "reading": "reference_dwelling",
 "model": "base",
 "legend": "Comparative relative index, not a cost estimate or quote",
 "ceilings": {
  "far_sqft": null,
  "one_floor_max_sqft": null,
  "budget_fraction": null,
  "budget": null,
  "governing": "program_complete"
 },
 "household": {
  "archetype_id": "empty_nest",
  "kitchen_typology": "open_island",
  "culture_applied": true
 },
 "quality_note": "Program-level quality proxy in [0, 1] (step 6.5d): value of each upgrade over the minimum program. Geometry-aware quality comes in step 6.8.",
 "curve": [
  {
   "step": 0,
   "move": null,
   "index": 0.5779,
   "quality": 0.0585,
   "gross_area_sqft": 1155.8
  },
  {
   "step": 1,
   "move": "add:pantry:general",
   "index": 0.5865,
   "quality": 0.1326,
   "gross_area_sqft": 1173.0
  },
  {
   "step": 2,
   "move": "add:storage:general",
   "index": 0.5951,
   "quality": 0.2066,
   "gross_area_sqft": 1190.2
  },
  {
   "step": 3,
   "move": "add:half_bath:general",
   "index": 0.6066,
   "quality": 0.2807,
   "gross_area_sqft": 1213.2
  },
  {
   "step": 4,
   "move": "substitute:split_social",
   "index": 0.644,
   "quality": 0.4289,
   "gross_area_sqft": 1288.0
  },
  {
   "step": 5,
   "move": "add:mudroom:general",
   "index": 0.667,
   "quality": 0.5185,
   "gross_area_sqft": 1334.0
  },
  {
   "step": 6,
   "move": "add:walk_in_closet:primary",
   "index": 0.69,
   "quality": 0.5926,
   "gross_area_sqft": 1380.0
  },
  {
   "step": 7,
   "move": "add:mechanical:general",
   "index": 0.6986,
   "quality": 0.6176,
   "gross_area_sqft": 1397.2
  },
  {
   "step": 8,
   "move": "add:breakfast_nook:general",
   "index": 0.7389,
   "quality": 0.7073,
   "gross_area_sqft": 1477.8
  },
  {
   "step": 9,
   "move": "add:primary_bath:primary",
   "index": 0.7791,
   "quality": 0.7813,
   "gross_area_sqft": 1558.2
  },
  {
   "step": 10,
   "move": "add:flex_room:guest",
   "index": 0.8424,
   "quality": 0.8554,
   "gross_area_sqft": 1684.8
  },
  {
   "step": 11,
   "move": "substitute:primary_suite",
   "index": 0.9114,
   "quality": 0.9295,
   "gross_area_sqft": 1822.8
  },
  {
   "step": 12,
   "move": "size:social",
   "index": 0.9487,
   "quality": 0.945,
   "gross_area_sqft": 1897.5
  },
  {
   "step": 13,
   "move": "car:2",
   "index": 1.0465,
   "quality": 0.9762,
   "gross_area_sqft": 2093.0
  },
  {
   "step": 14,
   "move": "size:private",
   "index": 1.0868,
   "quality": 0.9882,
   "gross_area_sqft": 2173.5
  },
  {
   "step": 15,
   "move": "size:service",
   "index": 1.0954,
   "quality": 0.9907,
   "gross_area_sqft": 2190.8
  },
  {
   "step": 16,
   "move": "size:circulation",
   "index": 1.1126,
   "quality": 0.9948,
   "gross_area_sqft": 2225.2
  },
  {
   "step": 17,
   "move": "size:kitchen",
   "index": 1.1385,
   "quality": 1.0,
   "gross_area_sqft": 2277.0
  }
 ],
 "profiles": {
  "minimum": {
   "profile": "minimum",
   "gross_area_sqft": 1155.8,
   "index": 0.5779,
   "quality": 0.0585,
   "next_stage_coverage": 0.3125,
   "within_ceilings": true,
   "blocked_by": null,
   "garage_cars": 1,
   "upgraded_zones": [],
   "substitutions": [],
   "program": {
    "spaces": [
     {
      "space_id": "living_dining",
      "space_type": "living_dining",
      "zone": "social",
      "scale": "large",
      "wet": false,
      "min_area_sqft": 250.0,
      "target_area_sqft": 305.0,
      "floor_preference": null,
      "host_space_id": null,
      "household_role": "general"
     },
     {
      "space_id": "kitchen",
      "space_type": "kitchen",
      "zone": "kitchen",
      "scale": "normal",
      "wet": true,
      "min_area_sqft": 110.0,
      "target_area_sqft": 145.0,
      "floor_preference": null,
      "host_space_id": null,
      "household_role": "general"
     },
     {
      "space_id": "bedroom_primary",
      "space_type": "bedroom",
      "zone": "private",
      "scale": "normal",
      "wet": false,
      "min_area_sqft": 110.0,
      "target_area_sqft": 120.0,
      "floor_preference": null,
      "host_space_id": null,
      "household_role": "primary"
     },
     {
      "space_id": "bathroom",
      "space_type": "bathroom",
      "zone": "private",
      "scale": "intermediate",
      "wet": true,
      "min_area_sqft": 40.0,
      "target_area_sqft": 45.0,
      "floor_preference": null,
      "host_space_id": null,
      "household_role": "general"
     },
     {
      "space_id": "closet",
      "space_type": "closet",
      "zone": "private",
      "scale": "support",
      "wet": false,
      "min_area_sqft": 6.0,
      "target_area_sqft": 10.0,
      "floor_preference": null,
      "host_space_id": "bedroom_primary",
      "household_role": "general"
     },
     {
      "space_id": "foyer",
      "space_type": "foyer",
      "zone": "circulation",
      "scale": "intermediate",
      "wet": false,
      "min_area_sqft": 35.0,
      "target_area_sqft": 40.0,
      "floor_preference": null,
      "host_space_id": null,
      "household_role": "general"
     },
     {
      "space_id": "hall",
      "space_type": "hall",
      "zone": "circulation",
      "scale": "intermediate",
      "wet": false,
      "min_area_sqft": 40.0,
      "target_area_sqft": 75.0,
      "floor_preference": null,
      "host_space_id": null,
      "household_role": "general"
     },
     {
      "space_id": "laundry_closet",
      "space_type": "laundry_closet",
      "zone": "service",
      "scale": "support",
      "wet": true,
      "min_area_sqft": 12.0,
      "target_area_sqft": 15.0,
      "floor_preference": null,
      "host_space_id": "hall",
      "household_role": "general"
     },
     {
      "space_id": "garage_1car",
      "space_type": "garage_1car",
      "zone": "garage",
      "scale": "normal",
      "wet": false,
      "min_area_sqft": 220.0,
      "target_area_sqft": 250.0,
      "floor_preference": 0,
      "host_space_id": null,
      "household_role": "general"
     }
    ],
    "zone_budgets": {
     "social": {
      "min_sqft": 250.0,
      "max_sqft": 450.0
     },
     "private": {
      "min_sqft": 156.0,
      "max_sqft": 320.0
     },
     "kitchen": {
      "min_sqft": 110.0,
      "max_sqft": 250.0
     },
     "service": {
      "min_sqft": 12.0,
      "max_sqft": 35.0
     },
     "circulation": {
      "min_sqft": 75.0,
      "max_sqft": 270.0
     },
     "garage": {
      "min_sqft": 220.0,
      "max_sqft": 300.0
     }
    },
    "garage_cars": 1,
    "required_gross_area_sqft": null,
    "gross_factor": 1.15
   },
   "note": null,
   "feasibility": "no_lot",
   "review": {
    "buildable_as_stated": true,
    "counts": {
     "error": 0,
     "warning": 0,
     "info": 0
    },
    "findings": []
   }
  },
  "optimum": {
   "profile": "optimum",
   "gross_area_sqft": 1558.2,
   "index": 0.7791,
   "quality": 0.7813,
   "next_stage_coverage": 0.875,
   "within_ceilings": true,
   "blocked_by": null,
   "garage_cars": 1,
   "upgraded_zones": [],
   "substitutions": [
    "split_social"
   ],
   "program": {
    "spaces": [
     {
      "space_id": "living_room",
      "space_type": "living_room",
      "zone": "social",
      "scale": "large",
      "wet": false,
      "min_area_sqft": 200.0,
      "target_area_sqft": 240.0,
      "floor_preference": null,
      "host_space_id": null,
      "household_role": "general"
     },
     {
      "space_id": "dining_room",
      "space_type": "dining_room",
      "zone": "social",
      "scale": "normal",
      "wet": false,
      "min_area_sqft": 110.0,
      "target_area_sqft": 130.0,
      "floor_preference": null,
      "host_space_id": null,
      "household_role": "general"
     },
     {
      "space_id": "kitchen",
      "space_type": "kitchen",
      "zone": "kitchen",
      "scale": "normal",
      "wet": true,
      "min_area_sqft": 110.0,
      "target_area_sqft": 145.0,
      "floor_preference": null,
      "host_space_id": null,
      "household_role": "general"
     },
     {
      "space_id": "breakfast_nook",
      "space_type": "breakfast_nook",
      "zone": "social",
      "scale": "intermediate",
      "wet": false,
      "min_area_sqft": 70.0,
      "target_area_sqft": 70.0,
      "floor_preference": null,
      "host_space_id": null,
      "household_role": "general"
     },
     {
      "space_id": "pantry",
      "space_type": "pantry",
      "zone": "kitchen",
      "scale": "support",
      "wet": false,
      "min_area_sqft": 12.0,
      "target_area_sqft": 15.0,
      "floor_preference": null,
      "host_space_id": "kitchen",
      "household_role": "general"
     },
     {
      "space_id": "bedroom_primary",
      "space_type": "bedroom",
      "zone": "private",
      "scale": "normal",
      "wet": false,
      "min_area_sqft": 110.0,
      "target_area_sqft": 120.0,
      "floor_preference": null,
      "host_space_id": null,
      "household_role": "primary"
     },
     {
      "space_id": "primary_bath",
      "space_type": "primary_bath",
      "zone": "private",
      "scale": "intermediate",
      "wet": true,
      "min_area_sqft": 60.0,
      "target_area_sqft": 70.0,
      "floor_preference": 0,
      "host_space_id": null,
      "household_role": "primary"
     },
     {
      "space_id": "bathroom",
      "space_type": "bathroom",
      "zone": "private",
      "scale": "intermediate",
      "wet": true,
      "min_area_sqft": 40.0,
      "target_area_sqft": 45.0,
      "floor_preference": null,
      "host_space_id": null,
      "household_role": "general"
     },
     {
      "space_id": "walk_in_closet_primary",
      "space_type": "walk_in_closet",
      "zone": "private",
      "scale": "intermediate",
      "wet": false,
      "min_area_sqft": 35.0,
      "target_area_sqft": 40.0,
      "floor_preference": null,